{
  "schema": "agent-workflow-contract-acceptance/v1",
  "contract_id": "A6",
  "contract_name": "bootstrap-build-walking-skeleton",
  "coverage_kind": "named-skill",
  "implementation_ref": {
    "path": "agent-workflows/skills/bootstrap-build-walking-skeleton/SKILL.md",
    "digest": "sha256:5746e91d41ac3297cbb30bf88fe7c9846aa278c798763dba13167826c47bb133"
  },
  "test_ref": {
    "path": "agent-workflows/tests/test_walking_skeleton.py",
    "digest": "sha256:d0bbc9b2d3ad1600b08f40c09d71cf051f9f993628af63b002a890aedd8b7e07",
    "selector": "A6_WalkingSkeletonTests"
  },
  "status": "passed"
}
